{
  "brief_id": "SUNRISE-KIDS-TUYENSINH-2026-08",
  "source_angle_id": "A-01",
  "seeding": [
    {
      "seed_id": "SEED-01",
      "noi_dung": "Cho hỏi bên mình nhận bé mấy tuổi vậy ạ? Con em học lớp 1.",
      "vai_tro": "ASK"
    },
    {
      "seed_id": "SEED-02",
      "noi_dung": "Y chang con nhà mình luôn, ở trường học bao lâu mà gặp Tây là im thin thít.",
      "vai_tro": "RELATE"
    },
    {
      "seed_id": "SEED-03",
      "noi_dung": "Mình cho bé nhà mình học thử một buổi rồi, thấy con được gọi lên nói nhiều hơn mình tưởng.",
      "vai_tro": "EXPERIENCE"
    },
    {
      "seed_id": "SEED-04",
      "noi_dung": "Lớp học vào ngày nào trong tuần vậy ạ? Mình sắp xếp lịch đón con cho phù hợp.",
      "vai_tro": "CONDITION"
    },
    {
      "seed_id": "SEED-05",
      "noi_dung": "Đang tính nhắn tin hỏi lịch học thử cho bé đây.",
      "vai_tro": "CTA_NUDGE"
    }
  ],
  "image_brief": {
    "muc_tieu": "Minh hoạ bài Fanpage angle A-01 — cảnh lớp học nhỏ, bé được nói nhiều, không cần thấy mặt bé",
    "thong_diep_chinh": "Lớp học ấm áp, bé được chú ý, trợ giảng theo sát — không phải lớp đông ngồi nghe",
    "doi_tuong": "Phụ huynh PH1 — mẹ có con mới vào tiểu học, đang lo con chán học",
    "kenh": "Fanpage",
    "ty_le": "4:5",
    "phong_cach": "Ảnh thật, ánh sáng tự nhiên ban ngày, tông màu ấm vàng nhạt, không dàn dựng cứng nhắc",
    "bo_cuc": "Toàn cảnh góc chéo lớp học nhỏ, quay từ phía sau lưng các bé, trợ giảng cúi xuống lắng nghe một bé nói, bàn ghế gọn gàng",
    "chu_tren_anh": "",
    "khong_duoc_xuat_hien": [
      "Mặt trẻ em rõ nét",
      "Tên hoặc logo trung tâm khác",
      "Chữ tiếng Việt trên ảnh (chèn sau bằng Canva)"
    ]
  },
  "image_prompt": "A warm, softly lit documentary-style photo of a small children's English classroom, shot from behind so only the backs of children's heads and shoulders are visible, seated at small round tables. A Vietnamese teaching assistant leans down gently listening to one child speak. Natural daylight through a window, warm soft yellow tone, shallow depth of field, vertical 4:5 portrait composition. No children's faces visible, no text, no lettering, no logos, no competitor branding.",
  "review_note": "Ảnh không quay mặt bé — kiểm kỹ trước khi duyệt xem model sinh ảnh có lỡ vẽ mặt trẻ em rõ nét không, đây là ràng buộc bắt buộc với sản phẩm liên quan trẻ em."
}
